variable_name,description,data_type,min,max,units,enumerations,comment
sample_id,The unique identifier for this Sample.,string,,,,,
biospecimen_collection_id,Biospecimen Collection during which this sample was generated.,string,,,,,Foreign Key: BiospecimenCollection.biospecimen_collection_id
parent_sample_id,Sample from which this sample is derived,string,,,,,Foreign Key: Sample.sample_id
sample_type,Type of material of which this Sample is comprised. UBERON is recommended.,string,,,,,
availablity_status,Can this Sample be requested for further analysis?,enumeration,,,,available=Biospecimen is Available;unavailable=Biospecimen is Unavailable,
quantity_number,The total quantity of the specimen,number,,,,,
quantity_unit,The structured term defining the units of the quantity.,string,,,,,Foreign Key: Concept.concept_curie
access_policy_id,Global identifier for the access policy that applies to this row of data.,string,,,,,Foreign Key: AccessPolicy.access_policy_id
study_id,INCLUDE Global ID for the study,string,,,,,Foreign Key: Study.study_id
