variable_name,description,data_type,min,max,units,enumerations,comment
research_study_collection_id,Global ID for this record,string,,,,,
description,More details associated with the given resource,string,,,,,
collection_title,The collection's title.,string,,,,,
research_study_collection_type,The type of collection being described.,enumeration,,,,consortium=Consortium;program=Program;user_defined=User Defined,
website,"URL describing the entity this represents. This can include a formal website, such as the Entity's website, or to an online document describing the entity.",string,,,,,
collection_status,The current state of the collection,enumeration,,,,current=Current;retired=Retired,
access_policy_id,Access Policy Global ID,string,,,,,Foreign Key: AccessPolicy.access_policy_id
